{
  "$schema": "http://json-schema.org/draft-07/schema#",
  "title": "Operational Reality Event",
  "description": "Minimal structure required for an event to be considered operationally real within the AI Philosophical Framework.",
  "type": "object",

  "required": [
    "decision",
    "cost",
    "trace",
    "time"
  ],

  "properties": {

    "decision": {
      "type": "string",
      "description": "Agent decision that initiated the event"
    },

    "cost": {
      "type": "string",
      "description": "Resource expenditure, risk, or sacrifice generated by the decision"
    },

    "trace": {
      "type": "string",
      "description": "Observable effect or record that allows reconstruction of the event"
    },

    "time": {
      "type": "string",
      "description": "Timestamp or temporal exposure of the event",
      "format": "date-time"
    },

    "agent": {
      "type": "string",
      "description": "Human, institutional, or AI entity responsible for the decision"
    },

    "context": {
      "type": "string",
      "description": "Optional contextual description of the event"
    }

  }
}
