{
  "decision": "Create the ai-philosophical-framework repository",
  "cost": "Time, intellectual effort, and public exposure",
  "trace": "GitHub repository created with foundational files committed",
  "time": "2026-03-09T12:00:00Z",
  "agent": "Manuel Coletta",
  "context": "Initial publication of the framework vision and operational structure on GitHub"
}
